,source_url,access_datetime,content,words,count
0,https://api.uza.uz/api/v1/posts/431915,1670798448,xalqaro gumanitar tashkilotlar malumotiga kora  yil uyini noiloj tark etganlar soni  milliondan oshgan qurolli mojaro ijtimoiy tengsizlik zoravonlik yoki tabiiy ofat tufayli kochirilganlarning aksariyati yillar hatto on yillar davomida mamlakat ichida qamalib qolmoqda deyiladi hisobotda binobarin ayni muammo haqida kamdankam gapiriladi bunday odamlar zarur yordamni doim ham ololmaydi birlashgan millatlar tashkiloti taraqqiyot dasturi bmttd yangi hisoboti mualliflari shunday demoqdabmt matbuot xizmati yozishicha  yil oxirida jami  million kishi boshqa joyga kochirilgan qochqinlar boyicha oliy komissar boshqarmasi malumotiga kora oshandan beri ukrainada  millionga yaqin kishi uyini tashlab xavfsiz hududga kochib otganiqlim ozgarishi harorat kotarilishi natijasida qator mintaqalarda qurgoqchilik suv toshqini yuz bermoqda anomal hodisa bilan bogliq muammo ham odamlarni yangi hayot maskani qidirishga majbur qilmoqda mutaxassislar takidlashicha  yilga borib iqlim ozgarishi tufayli  milliondan koproq inson oz xonadoni hayoti va tirikchilik vositasini tashlab xavfsizroq hududga kochib otishi mumkin ekan muhojirlar birinchi navbatda asosiy ehtiyojni qondirish qolaversa munosib ish barqaror daromad topish soglom bolish va farzandlarini maktabga joylashtirishlari zarur aysuski bu masalalarda koplab muammolar kondalang majburiy kochishdan ayniqsa keksalar ayollar bolalar va boshqa zaif guruhlar jiddiy aziyat chekmoqdabmt taraqqiyot dasturi rahbari akim shtayner kochirilgan odamlar fuqaro sifatida toliq huquqdan masalan sogliqni saqlash talim ijtimoiy himoya va ish taminoti kabi muhim xizmatlardan foydalanish imkoniga ega bolishi kerak deydi bu masalada marginallashuvga yol qoymaslik uchun kop ish olib borilishi lozim uning takidlashicha insonparvarlik yordami bilan birga rivojlanishga yonaltirilgan yanada samarali yondashuv tinchlik barqarorlik va tiklanish uchun sharoit yaratishga yordam beradiichki kochish monitoringi markazi tomonidan kolumbiya efiopiya indoneziya nepal nigeriya papuayangi gvineya somali va vanuatudan taqdim etilgan malumotlar tahlili shuni korsatmoqdaki ichki kochirilganlarning uchdan bir qismi ishsiz bundaylarning  foizi yashash uchun puli yoqligini yana bir qismi uyini tark etgach sogligi yomonlashganini takidlaganhisobot mualliflari hukumatlar ichki kochirilganlar muammosini hal etish boyicha alohida ish olib borishlari lozimligini uqtirmoqda xususan aholining ushbu toifasi risoladagidek yashash sharoitiga ega bolishi asosiy xizmatlardan foydalanishi shuningdek yangi joyga integratsiyalashishi zarurinson nima uchun kochadi ozi yashab turgan qadrdon manzilini tashlab boshqa xavfsiz manzilga otish uchun mashaqqatli mavhum va xafli uzoq yolga chiqadi bu muammoning ildiziga etibor qaratiladigan bolsa aksariyat hollarda ijtimoiy beqarorlik gumanitar inqiroz siyosiy keskinlik va qurolli nizo shunday holatlarni keltirib chiqarayotganiga guvoh bolamiz qochqinlarga vaqtinchalik boshpana berish ularni boqish uchun mablag toplash va buni hisobotda qayd etish matbuotda bong urish masalaning uzilkesil yechimi emasligi jahon hamjamiyati ushbu global muammoga boshqacha samarali yondashishi shartligi tobora ayon bolmoqdas rahimovoza,"['xalqaro', 'gumanitar', 'tashkilotlar', 'malumotiga', 'kora', 'yil', 'uyini', 'noiloj', 'tark', 'etganlar', 'soni', 'milliondan', 'oshgan', 'qurolli', 'mojaro', 'ijtimoiy', 'tengsizlik', 'zoravonlik', 'yoki', 'tabiiy', 'ofat', 'tufayli', 'kochirilganlarning', 'aksariyati', 'yillar', 'hatto', 'on', 'yillar', 'davomida', 'mamlakat', 'ichida', 'qamalib', 'qolmoqda', 'deyiladi', 'hisobotda', 'binobarin', 'ayni', 'muammo', 'haqida', 'kamdankam', 'gapiriladi', 'bunday', 'odamlar', 'zarur', 'yordamni', 'doim', 'ham', 'ololmaydi', 'birlashgan', 'millatlar', 'tashkiloti', 'taraqqiyot', 'dasturi', 'bmttd', 'yangi', 'hisoboti', 'mualliflari', 'shunday', 'demoqdabmt', 'matbuot', 'xizmati', 'yozishicha', 'yil', 'oxirida', 'jami', 'million', 'kishi', 'boshqa', 'joyga', 'kochirilgan', 'qochqinlar', 'boyicha', 'oliy', 'komissar', 'boshqarmasi', 'malumotiga', 'kora', 'oshandan', 'beri', 'ukrainada', 'millionga', 'yaqin', 'kishi', 'uyini', 'tashlab', 'xavfsiz', 'hududga', 'kochib', 'otganiqlim', 'ozgarishi', 'harorat', 'kotarilishi', 'natijasida', 'qator', 'mintaqalarda', 'qurgoqchilik', 'suv', 'toshqini', 'yuz', 'bermoqda', 'anomal', 'hodisa', 'bilan', 'bogliq', 'muammo', 'ham', 'odamlarni', 'yangi', 'hayot', 'maskani', 'qidirishga', 'majbur', 'qilmoqda', 'mutaxassislar', 'takidlashicha', 'yilga', 'borib', 'iqlim', 'ozgarishi', 'tufayli', 'milliondan', 'koproq', 'inson', 'oz', 'xonadoni', 'hayoti', 'va', 'tirikchilik', 'vositasini', 'tashlab', 'xavfsizroq', 'hududga', 'kochib', 'otishi', 'mumkin', 'ekan', 'muhojirlar', 'birinchi', 'navbatda', 'asosiy', 'ehtiyojni', 'qondirish', 'qolaversa', 'munosib', 'ish', 'barqaror', 'daromad', 'topish', 'soglom', 'bolish', 'va', 'farzandlarini', 'maktabga', 'joylashtirishlari', 'zarur', 'aysuski', 'bu', 'masalalarda', 'koplab', 'muammolar', 'kondalang', 'majburiy', 'kochishdan', 'ayniqsa', 'keksalar', 'ayollar', 'bolalar', 'va', 'boshqa', 'zaif', 'guruhlar', 'jiddiy', 'aziyat', 'chekmoqdabmt', 'taraqqiyot', 'dasturi', 'rahbari', 'akim', 'shtayner', 'kochirilgan', 'odamlar', 'fuqaro', 'sifatida', 'toliq', 'huquqdan', 'masalan', 'sogliqni', 'saqlash', 'talim', 'ijtimoiy', 'himoya', 'va', 'ish', 'taminoti', 'kabi', 'muhim', 'xizmatlardan', 'foydalanish', 'imkoniga', 'ega', 'bolishi', 'kerak', 'deydi', 'bu', 'masalada', 'marginallashuvga', 'yol', 'qoymaslik', 'uchun', 'kop', 'ish', 'olib', 'borilishi', 'lozim', 'uning', 'takidlashicha', 'insonparvarlik', 'yordami', 'bilan', 'birga', 'rivojlanishga', 'yonaltirilgan', 'yanada', 'samarali', 'yondashuv', 'tinchlik', 'barqarorlik', 'va', 'tiklanish', 'uchun', 'sharoit', 'yaratishga', 'yordam', 'beradiichki', 'kochish', 'monitoringi', 'markazi', 'tomonidan', 'kolumbiya', 'efiopiya', 'indoneziya', 'nepal', 'nigeriya', 'papuayangi', 'gvineya', 'somali', 'va', 'vanuatudan', 'taqdim', 'etilgan', 'malumotlar', 'tahlili', 'shuni', 'korsatmoqdaki', 'ichki', 'kochirilganlarning', 'uchdan', 'bir', 'qismi', 'ishsiz', 'bundaylarning', 'foizi', 'yashash', 'uchun', 'puli', 'yoqligini', 'yana', 'bir', 'qismi', 'uyini', 'tark', 'etgach', 'sogligi', 'yomonlashganini', 'takidlaganhisobot', 'mualliflari', 'hukumatlar', 'ichki', 'kochirilganlar', 'muammosini', 'hal', 'etish', 'boyicha', 'alohida', 'ish', 'olib', 'borishlari', 'lozimligini', 'uqtirmoqda', 'xususan', 'aholining', 'ushbu', 'toifasi', 'risoladagidek', 'yashash', 'sharoitiga', 'ega', 'bolishi', 'asosiy', 'xizmatlardan', 'foydalanishi', 'shuningdek', 'yangi', 'joyga', 'integratsiyalashishi', 'zarurinson', 'nima', 'uchun', 'kochadi', 'ozi', 'yashab', 'turgan', 'qadrdon', 'manzilini', 'tashlab', 'boshqa', 'xavfsiz', 'manzilga', 'otish', 'uchun', 'mashaqqatli', 'mavhum', 'va', 'xafli', 'uzoq', 'yolga', 'chiqadi', 'bu', 'muammoning', 'ildiziga', 'etibor', 'qaratiladigan', 'bolsa', 'aksariyat', 'hollarda', 'ijtimoiy', 'beqarorlik', 'gumanitar', 'inqiroz', 'siyosiy', 'keskinlik', 'va', 'qurolli', 'nizo', 'shunday', 'holatlarni', 'keltirib', 'chiqarayotganiga', 'guvoh', 'bolamiz', 'qochqinlarga', 'vaqtinchalik', 'boshpana', 'berish', 'ularni', 'boqish', 'uchun', 'mablag', 'toplash', 'va', 'buni', 'hisobotda', 'qayd', 'etish', 'matbuotda', 'bong', 'urish', 'masalaning', 'uzilkesil', 'yechimi', 'emasligi', 'jahon', 'hamjamiyati', 'ushbu', 'global', 'muammoga', 'boshqacha', 'samarali', 'yondashishi', 'shartligi', 'tobora', 'ayon', 'bolmoqdas', 'rahimovoza']",384
1,https://api.uza.uz/api/v1/posts/431906,1670798448,ushbu ezgu amallarni izchil davom ettirgan holda mahalla xayriya jamoat fondi qoraqalpogiston respublikasi bolimi hamda nogironlar jamiyati qoraqalpogiston respublikasi bolimi tomonidan nukus shahridagi imkoniyati cheklangan alohida yordamga muhtoj fuqarolarning konglini kotarish maqsadida ularga oziqovqat mahsulotlari bayram sovgalari topshirildi shuningdek xalqaro nogironlar kuni munosabati bilan tortkol tumani hokimligi mahalla xayriya jamoat fondi tortkol tuman bolinmasi bilan hamkorlikda yordamga muhtoj insonlarning holidan xabar olindi shu munosabat bilan otkazilgan tadbirda qayd etilganidek komakka muhtojlarga yordam qolini chozish ezgu qadriyatga aylangan shu jumladan keksalar nogironligi bolgan shaxslar kam taminlangan fuqarolarni moddiy va manaviy qollabquvvatlash har birimizning insoniylik burchimiz maqsadimiz esa oksik kongillarga quvonch ulashishdir tadbir davomida kaltaminor ovul fuqarolar yiginida istiqomat qiluvchi guruh nogironligi bolgan ggurbannazarov oilasidan ham xabar olinib mahalla xayriya jamoat fondi tortkol tuman bolinmasi tomonidan oziqovqat mahsulotlari topshirildi dovud abibullayev oza,"['ushbu', 'ezgu', 'amallarni', 'izchil', 'davom', 'ettirgan', 'holda', 'mahalla', 'xayriya', 'jamoat', 'fondi', 'qoraqalpogiston', 'respublikasi', 'bolimi', 'hamda', 'nogironlar', 'jamiyati', 'qoraqalpogiston', 'respublikasi', 'bolimi', 'tomonidan', 'nukus', 'shahridagi', 'imkoniyati', 'cheklangan', 'alohida', 'yordamga', 'muhtoj', 'fuqarolarning', 'konglini', 'kotarish', 'maqsadida', 'ularga', 'oziqovqat', 'mahsulotlari', 'bayram', 'sovgalari', 'topshirildi', 'shuningdek', 'xalqaro', 'nogironlar', 'kuni', 'munosabati', 'bilan', 'tortkol', 'tumani', 'hokimligi', 'mahalla', 'xayriya', 'jamoat', 'fondi', 'tortkol', 'tuman', 'bolinmasi', 'bilan', 'hamkorlikda', 'yordamga', 'muhtoj', 'insonlarning', 'holidan', 'xabar', 'olindi', 'shu', 'munosabat', 'bilan', 'otkazilgan', 'tadbirda', 'qayd', 'etilganidek', 'komakka', 'muhtojlarga', 'yordam', 'qolini', 'chozish', 'ezgu', 'qadriyatga', 'aylangan', 'shu', 'jumladan', 'keksalar', 'nogironligi', 'bolgan', 'shaxslar', 'kam', 'taminlangan', 'fuqarolarni', 'moddiy', 'va', 'manaviy', 'qollabquvvatlash', 'har', 'birimizning', 'insoniylik', 'burchimiz', 'maqsadimiz', 'esa', 'oksik', 'kongillarga', 'quvonch', 'ulashishdir', 'tadbir', 'davomida', 'kaltaminor', 'ovul', 'fuqarolar', 'yiginida', 'istiqomat', 'qiluvchi', 'guruh', 'nogironligi', 'bolgan', 'ggurbannazarov', 'oilasidan', 'ham', 'xabar', 'olinib', 'mahalla', 'xayriya', 'jamoat', 'fondi', 'tortkol', 'tuman', 'bolinmasi', 'tomonidan', 'oziqovqat', 'mahsulotlari', 'topshirildi', 'dovud', 'abibullayev', 'oza']",130
2,https://api.uza.uz/api/v1/posts/431904,1670798448,ozbekistonning amaldagi chempioni va mamlakat kubogi sohibi jizzax shahrining jizzaxkyentyeks klubi ushbu turda olmaliq shahrining agmk jamoasi bilan kuch sinashib joriy mavsumda ilk bor maglub boldi gollarga jizzaxliklardan ilhomjon hamroyev hamda elbek tolqinov mualliflik qilgan bolsa agmk futzalchilari xayrulla solihov  bor ravshan ismatullayev  marta davlat ibragimov hamda avazbek abduvaliyev bir martadan jizzaxkyentyeks darvozasini ishgol etib konchilarning yirik hisobdagi galabasini taminlashga munosib hissa qoshdi jizzaxkyentyeks  agmk oyinidagi yakuniy hisob   olmaliqlik futbolchilar foydasiga hal boldi turning qolgan uchrashuvlarida quyidagi natijalar qayd etildi metallurg bekobod  bunyodkor toshkent   maksamchirchiq chirchiq  oilstar kogon   nasaf qarshi  lokomotiv toshkent   jizzaxliklarning maglubiyatidan unumli foydalangan toshkentning bmb klubi shu turning keyingi uchrashuvida aynan agmkni  hisobida dogda qoldirib turnir jadvalida yagona peshqadamga aylanib oldi aqayumov oza,"['ozbekistonning', 'amaldagi', 'chempioni', 'va', 'mamlakat', 'kubogi', 'sohibi', 'jizzax', 'shahrining', 'jizzaxkyentyeks', 'klubi', 'ushbu', 'turda', 'olmaliq', 'shahrining', 'agmk', 'jamoasi', 'bilan', 'kuch', 'sinashib', 'joriy', 'mavsumda', 'ilk', 'bor', 'maglub', 'boldi', 'gollarga', 'jizzaxliklardan', 'ilhomjon', 'hamroyev', 'hamda', 'elbek', 'tolqinov', 'mualliflik', 'qilgan', 'bolsa', 'agmk', 'futzalchilari', 'xayrulla', 'solihov', 'bor', 'ravshan', 'ismatullayev', 'marta', 'davlat', 'ibragimov', 'hamda', 'avazbek', 'abduvaliyev', 'bir', 'martadan', 'jizzaxkyentyeks', 'darvozasini', 'ishgol', 'etib', 'konchilarning', 'yirik', 'hisobdagi', 'galabasini', 'taminlashga', 'munosib', 'hissa', 'qoshdi', 'jizzaxkyentyeks', 'agmk', 'oyinidagi', 'yakuniy', 'hisob', 'olmaliqlik', 'futbolchilar', 'foydasiga', 'hal', 'boldi', 'turning', 'qolgan', 'uchrashuvlarida', 'quyidagi', 'natijalar', 'qayd', 'etildi', 'metallurg', 'bekobod', 'bunyodkor', 'toshkent', 'maksamchirchiq', 'chirchiq', 'oilstar', 'kogon', 'nasaf', 'qarshi', 'lokomotiv', 'toshkent', 'jizzaxliklarning', 'maglubiyatidan', 'unumli', 'foydalangan', 'toshkentning', 'bmb', 'klubi', 'shu', 'turning', 'keyingi', 'uchrashuvida', 'aynan', 'agmkni', 'hisobida', 'dogda', 'qoldirib', 'turnir', 'jadvalida', 'yagona', 'peshqadamga', 'aylanib', 'oldi', 'aqayumov', 'oza']",116
3,https://api.uza.uz/api/v1/posts/431902,1670798448,viloyatda yashil makon umummilliy loyihasi doirasida manzarali hamda mevali daraxt kochatlarini ekish bilan bir qatorda rayhon va yalpiz kochatlarini yetishtirish boyicha ham tayyorgarlik ishlari olib borilmoqda ozbekiston respublikasi ekologiya va atrofmuhitni muhofaza qilish davlat qomitasi huzuridagi atrofmuhit va tabiatni muhofaza qilish texnologiyalar ilmiy tadqiqot instituti olimlari tavsiyalari asosida sirdaryo viloyati ekologiya boshqarmasi xodimlari tashabbusi bilan guliston shahrida yashovchi  nafar boshqarma xodimi xonadonlaridagi mavjud issiqxonalarda rayhon va yalpiz kochatlari yetishtirish uchun hozirlik korilmoqda ushbu xonadonlarda  yil bahor mavsumida  sotix issiqxonalarga  million dona rayhon va yalpiz kochatlari yetishtirilishi rejalashtirilgan ayni paytda issiqxonalarda tayyorgarlik ishlari olib borilmoqda shsuyarov oza,"['viloyatda', 'yashil', 'makon', 'umummilliy', 'loyihasi', 'doirasida', 'manzarali', 'hamda', 'mevali', 'daraxt', 'kochatlarini', 'ekish', 'bilan', 'bir', 'qatorda', 'rayhon', 'va', 'yalpiz', 'kochatlarini', 'yetishtirish', 'boyicha', 'ham', 'tayyorgarlik', 'ishlari', 'olib', 'borilmoqda', 'ozbekiston', 'respublikasi', 'ekologiya', 'va', 'atrofmuhitni', 'muhofaza', 'qilish', 'davlat', 'qomitasi', 'huzuridagi', 'atrofmuhit', 'va', 'tabiatni', 'muhofaza', 'qilish', 'texnologiyalar', 'ilmiy', 'tadqiqot', 'instituti', 'olimlari', 'tavsiyalari', 'asosida', 'sirdaryo', 'viloyati', 'ekologiya', 'boshqarmasi', 'xodimlari', 'tashabbusi', 'bilan', 'guliston', 'shahrida', 'yashovchi', 'nafar', 'boshqarma', 'xodimi', 'xonadonlaridagi', 'mavjud', 'issiqxonalarda', 'rayhon', 'va', 'yalpiz', 'kochatlari', 'yetishtirish', 'uchun', 'hozirlik', 'korilmoqda', 'ushbu', 'xonadonlarda', 'yil', 'bahor', 'mavsumida', 'sotix', 'issiqxonalarga', 'million', 'dona', 'rayhon', 'va', 'yalpiz', 'kochatlari', 'yetishtirilishi', 'rejalashtirilgan', 'ayni', 'paytda', 'issiqxonalarda', 'tayyorgarlik', 'ishlari', 'olib', 'borilmoqda', 'shsuyarov', 'oza']",96
4,https://api.uza.uz/api/v1/posts/431900,1670798448, dekabr  xalqaro nogironlar kuni hamda mehrmuruvvat oyligi munosabati bilan navbatdagi xayriya tadbirlari otkazildi yelobod shaharcha fuqarolar yiginida istiqomat qiluvchi kam taminlangan oilalarga oziqovqat mahsulotlari topshirildi bir guruh oquvchilarga zamonaviy noutbuk sovga qilindi joylarda otkazilayotgan xayriya tadbirlari davlatimiz rahbarining ozbekiston xalqiga murojaatida qayd etilganidek nogironligi bolgan shaxslarni jamiyatimizning tolaqonli azosi deb his etish imkonini bermoqda dovud abibullayev oza,"['dekabr', 'xalqaro', 'nogironlar', 'kuni', 'hamda', 'mehrmuruvvat', 'oyligi', 'munosabati', 'bilan', 'navbatdagi', 'xayriya', 'tadbirlari', 'otkazildi', 'yelobod', 'shaharcha', 'fuqarolar', 'yiginida', 'istiqomat', 'qiluvchi', 'kam', 'taminlangan', 'oilalarga', 'oziqovqat', 'mahsulotlari', 'topshirildi', 'bir', 'guruh', 'oquvchilarga', 'zamonaviy', 'noutbuk', 'sovga', 'qilindi', 'joylarda', 'otkazilayotgan', 'xayriya', 'tadbirlari', 'davlatimiz', 'rahbarining', 'ozbekiston', 'xalqiga', 'murojaatida', 'qayd', 'etilganidek', 'nogironligi', 'bolgan', 'shaxslarni', 'jamiyatimizning', 'tolaqonli', 'azosi', 'deb', 'his', 'etish', 'imkonini', 'bermoqda', 'dovud', 'abibullayev', 'oza']",57
